{
  "acpBoundary": {
    "candidateAdmissionOwner": "kotlin-jvm-host",
    "candidateContribution": "authenticated-session-change-build-artifact-provenance",
    "candidateLiveExecutionOwner": "separately-reviewed-kotlin-jvm-host",
    "candidateProvenanceAccess": "read-only-oracle-input",
    "certificationAuthority": false,
    "containmentAuthority": false,
    "observationAuthoringAuthority": false,
    "oracleAuthority": false,
    "policyAuthoringAuthority": false,
    "referenceAuthoringAuthority": false,
    "referenceSubjectAdmission": "kotlin-jvm-host-only",
    "releaseAuthority": false,
    "role": "first-class-candidate-producer-operator",
    "scoringAuthority": false,
    "startAuthority": false,
    "terminalAbsenceAuthority": false,
    "validationAuthority": false
  },
  "authority": "kotlin-jvm-authored-reference-input-plan-v2",
  "captureContract": {
    "artifacts": "complete-final-workspace-tree",
    "exitStatus": "raw-process-exit-status",
    "normalizations": [],
    "stderr": "raw-bytes",
    "stdout": "raw-bytes"
  },
  "cases": [
    {
      "arguments": [
        "-c",
        "broken.s",
        "-o",
        "broken.o"
      ],
      "categories": [
        "assembler",
        "diagnostics",
        "exit-status",
        "stderr"
      ],
      "environment": {},
      "id": "assemble-invalid",
      "inputs": [
        {
          "base64": "LnRleHQKYW5zd2VyOgogIGRlZmluaXRlbHlfbm90X2FuX2luc3RydWN0aW9uCg==",
          "bytes": 46,
          "executable": false,
          "kind": "literal",
          "path": "broken.s",
          "sha256": "43d7636c8c19743b1c82dbcf9ff9cf001ac55040a589e56757f960e1f1587b49"
        }
      ],
      "ownerSubsystem": "clang-integrated-assembler",
      "stdin": {
        "base64": "",
        "bytes": 0,
        "sha256": "e3b0c44298fc1c149afbf4c8996fb92427ae41e4649b934ca495991b7852b855"
      }
    },
    {
      "arguments": [
        "-c",
        "answer.s",
        "-o",
        "answer.o"
      ],
      "categories": [
        "artifacts",
        "assembler",
        "object-emission"
      ],
      "environment": {},
      "id": "assemble-valid",
      "inputs": [
        {
          "base64": "LnRleHQKLmdsb2JsIGFuc3dlcgoudHlwZSBhbnN3ZXIsQGZ1bmN0aW9uCmFuc3dlcjoKICBtb3YgJDQyLCAlZWF4CiAgcmV0Cg==",
          "bytes": 73,
          "executable": false,
          "kind": "literal",
          "path": "answer.s",
          "sha256": "15f56ddb58bac5508ac5da351eadecedcc5fe747891b8fb2def12ac90d7492e4"
        }
      ],
      "ownerSubsystem": "clang-integrated-assembler",
      "stdin": {
        "base64": "",
        "bytes": 0,
        "sha256": "e3b0c44298fc1c149afbf4c8996fb92427ae41e4649b934ca495991b7852b855"
      }
    },
    {
      "arguments": [
        "-nostdinc",
        "-std=c17",
        "-pedantic-errors",
        "-c",
        "source.c",
        "-o",
        "c17.o"
      ],
      "categories": [
        "artifacts",
        "c",
        "file-compile",
        "language-standard"
      ],
      "environment": {},
      "id": "compile-c-standard",
      "inputs": [
        {
          "base64": "aW50IGFuc3dlcih2b2lkKSB7IHJldHVybiA0MjsgfQo=",
          "bytes": 32,
          "executable": false,
          "kind": "literal",
          "path": "source.c",
          "sha256": "d2ee72eea6fb9b6a2ce93777ac97e9f1d7183f9233923f434ff0d9f61a4aa9d5"
        }
      ],
      "ownerSubsystem": "clang-codegen",
      "stdin": {
        "base64": "",
        "bytes": 0,
        "sha256": "e3b0c44298fc1c149afbf4c8996fb92427ae41e4649b934ca495991b7852b855"
      }
    },
    {
      "arguments": [
        "-nostdinc",
        "-std=c++20",
        "-c",
        "source.cpp",
        "-o",
        "cxx20.o"
      ],
      "categories": [
        "artifacts",
        "cxx",
        "file-compile",
        "language-standard",
        "templates"
      ],
      "environment": {},
      "id": "compile-cxx-standard",
      "inputs": [
        {
          "base64": "dGVtcGxhdGUgPGNsYXNzIFQ+IFQgdHdpY2UoVCB2YWx1ZSkgeyByZXR1cm4gdmFsdWUgKyB2YWx1ZTsgfQppbnQgYW5zd2VyKCkgeyByZXR1cm4gdHdpY2UoMjEpOyB9Cg==",
          "bytes": 97,
          "executable": false,
          "kind": "literal",
          "path": "source.cpp",
          "sha256": "b6816e00ee73a2fcfc701afc4036655139cc901fe2eca531871100ab2b70e7fa"
        }
      ],
      "ownerSubsystem": "clang-codegen",
      "stdin": {
        "base64": "",
        "bytes": 0,
        "sha256": "e3b0c44298fc1c149afbf4c8996fb92427ae41e4649b934ca495991b7852b855"
      }
    },
    {
      "arguments": [
        "-c",
        "source.c",
        "-o",
        "source.o"
      ],
      "categories": [
        "artifacts",
        "file-compile"
      ],
      "environment": {},
      "id": "compile-file",
      "inputs": [
        {
          "base64": "aW50IGFuc3dlcih2b2lkKSB7IHJldHVybiA0MjsgfQo=",
          "bytes": 32,
          "executable": false,
          "kind": "literal",
          "path": "source.c",
          "sha256": "d2ee72eea6fb9b6a2ce93777ac97e9f1d7183f9233923f434ff0d9f61a4aa9d5"
        }
      ],
      "ownerSubsystem": "clang-codegen",
      "stdin": {
        "base64": "",
        "bytes": 0,
        "sha256": "e3b0c44298fc1c149afbf4c8996fb92427ae41e4649b934ca495991b7852b855"
      }
    },
    {
      "arguments": [
        "-x",
        "c",
        "-c",
        "-",
        "-o",
        "stdin.o"
      ],
      "categories": [
        "artifacts",
        "file-compile",
        "stdin"
      ],
      "environment": {},
      "id": "compile-stdin",
      "inputs": [],
      "ownerSubsystem": "clang-codegen",
      "stdin": {
        "base64": "aW50IGFuc3dlcih2b2lkKSB7IHJldHVybiA0MjsgfQo=",
        "bytes": 32,
        "sha256": "d2ee72eea6fb9b6a2ce93777ac97e9f1d7183f9233923f434ff0d9f61a4aa9d5"
      }
    },
    {
      "arguments": [
        "-fcolor-diagnostics",
        "-fsyntax-only",
        "broken.c"
      ],
      "categories": [
        "color",
        "diagnostics",
        "exit-status",
        "stderr"
      ],
      "environment": {},
      "id": "diagnostic-color-always",
      "inputs": [
        {
          "base64": "aW50IGJyb2tlbiggewo=",
          "bytes": 14,
          "executable": false,
          "kind": "literal",
          "path": "broken.c",
          "sha256": "30b71af0334678bd5e966ceabc8d45ffe9402ffd629eea256ca129e60b708616"
        }
      ],
      "ownerSubsystem": "clang-diagnostics-renderer",
      "stdin": {
        "base64": "",
        "bytes": 0,
        "sha256": "e3b0c44298fc1c149afbf4c8996fb92427ae41e4649b934ca495991b7852b855"
      }
    },
    {
      "arguments": [
        "-fno-color-diagnostics",
        "-fsyntax-only",
        "broken.c"
      ],
      "categories": [
        "color",
        "diagnostics",
        "exit-status",
        "stderr"
      ],
      "environment": {},
      "id": "diagnostic-color-never",
      "inputs": [
        {
          "base64": "aW50IGJyb2tlbiggewo=",
          "bytes": 14,
          "executable": false,
          "kind": "literal",
          "path": "broken.c",
          "sha256": "30b71af0334678bd5e966ceabc8d45ffe9402ffd629eea256ca129e60b708616"
        }
      ],
      "ownerSubsystem": "clang-diagnostics-renderer",
      "stdin": {
        "base64": "",
        "bytes": 0,
        "sha256": "e3b0c44298fc1c149afbf4c8996fb92427ae41e4649b934ca495991b7852b855"
      }
    },
    {
      "arguments": [
        "-ferror-limit=2",
        "-fsyntax-only",
        "many.c"
      ],
      "categories": [
        "diagnostic-limits",
        "diagnostics",
        "exit-status",
        "stderr"
      ],
      "environment": {},
      "id": "diagnostic-error-limit",
      "inputs": [
        {
          "base64": "aW50IGEoIHsKaW50IGIoIHsKaW50IGMoIHsK",
          "bytes": 27,
          "executable": false,
          "kind": "literal",
          "path": "many.c",
          "sha256": "5a9942d2cfbc68b953954704ae377182d4c1f0a726ae03f00a2ace1a584eebce"
        }
      ],
      "ownerSubsystem": "clang-diagnostics-engine",
      "stdin": {
        "base64": "",
        "bytes": 0,
        "sha256": "e3b0c44298fc1c149afbf4c8996fb92427ae41e4649b934ca495991b7852b855"
      }
    },
    {
      "arguments": [
        "-fdiagnostics-parseable-fixits",
        "-fsyntax-only",
        "fixit.c"
      ],
      "categories": [
        "caret-ranges",
        "diagnostics",
        "exit-status",
        "fix-its",
        "stderr"
      ],
      "environment": {},
      "id": "diagnostic-fixit",
      "inputs": [
        {
          "base64": "aW50IG1haW4odm9pZCkgeyBpbnQgdmFsdWUgPSAxIHJldHVybiB2YWx1ZTsgfQo=",
          "bytes": 47,
          "executable": false,
          "kind": "literal",
          "path": "fixit.c",
          "sha256": "d50b14c48193d24493b0569b2866897cafd6fa10fedb78b5bdb90dad3dfdfb93"
        }
      ],
      "ownerSubsystem": "clang-parser",
      "stdin": {
        "base64": "",
        "bytes": 0,
        "sha256": "e3b0c44298fc1c149afbf4c8996fb92427ae41e4649b934ca495991b7852b855"
      }
    },
    {
      "arguments": [
        "--definitely-not-a-clang-option"
      ],
      "categories": [
        "diagnostics",
        "exit-status",
        "option-handling",
        "stderr"
      ],
      "environment": {},
      "id": "diagnostic-invalid-option",
      "inputs": [],
      "ownerSubsystem": "clang-driver-options",
      "stdin": {
        "base64": "",
        "bytes": 0,
        "sha256": "e3b0c44298fc1c149afbf4c8996fb92427ae41e4649b934ca495991b7852b855"
      }
    },
    {
      "arguments": [
        "-nostdinc",
        "-fsyntax-only",
        "missing.c"
      ],
      "categories": [
        "diagnostics",
        "fatal-errors",
        "include-search",
        "stderr"
      ],
      "environment": {},
      "id": "diagnostic-missing-include",
      "inputs": [
        {
          "base64": "I2luY2x1ZGUgImFic2VudC5oIgo=",
          "bytes": 20,
          "executable": false,